{
  "schema_version": "0.1.0",
  "environment": "test",
  "fixture_only": true,
  "run_id": "agent-run.fixture-001",
  "session_id": "planning-session.fixture-001",
  "state_owner": "deterministic_run_controller",
  "run_lineage_ref": "run-lineage.fixture-001",
  "base_session_revision": 3,
  "trigger": {
    "trigger_type": "user_turn",
    "trigger_ref": "user-turn.fixture-003"
  },
  "run_status": "paused",
  "stop_reason": "waiting_for_user",
  "current_step": "respond_or_stop",
  "pending_gate": {
    "gate_kind": "user_input",
    "gate_ref": "decision.fixture-clarification-001",
    "created_at": "2026-08-03T19:41:00+08:00"
  },
  "budget": {
    "limits": {
      "max_model_turns": 4,
      "max_tool_calls": 6,
      "max_plan_generations": 3,
      "max_same_tool_retries": 2,
      "wall_clock_deadline": "2026-08-03T19:50:00+08:00",
      "token_limit": 12000
    },
    "consumed": {
      "model_turns": 1,
      "tool_calls": 0,
      "plan_generations": 0,
      "tokens": 900
    },
    "tool_retry_counters": []
  },
  "context_manifest_refs": [
    "context-manifest.fixture-run-001"
  ],
  "action_proposal_refs": [
    "agent-action.fixture-clarify-001"
  ],
  "tool_call_refs": [],
  "observation_refs": [],
  "session_commit": {
    "commit_status": "committed",
    "expected_base_revision": 3,
    "committed_revision": 4
  },
  "started_at": "2026-08-03T19:39:00+08:00",
  "last_checkpoint_at": "2026-08-03T19:41:00+08:00",
  "metadata": {
    "x-fixture": true,
    "x-synthetic": true
  }
}
