{
  "schema_version": "0.1.0",
  "environment": "test",
  "fixture_only": true,
  "run_id": "agent-run.fixture-created-001",
  "session_id": "planning-session.fixture-001",
  "state_owner": "deterministic_run_controller",
  "run_lineage_ref": "run-lineage.fixture-created-001",
  "base_session_revision": 3,
  "trigger": {
    "trigger_type": "user_turn",
    "trigger_ref": "user-turn.fixture-created-001"
  },
  "run_status": "created",
  "current_step": "receive_event",
  "budget": {
    "limits": {
      "max_model_turns": 4,
      "max_tool_calls": 6,
      "max_plan_generations": 3,
      "max_same_tool_retries": 2,
      "wall_clock_deadline": "2026-08-03T19:50:00+08:00",
      "token_limit": 12000
    },
    "consumed": {
      "model_turns": 0,
      "tool_calls": 0,
      "plan_generations": 0,
      "tokens": 0
    },
    "tool_retry_counters": []
  },
  "context_manifest_refs": [],
  "action_proposal_refs": [],
  "tool_call_refs": [],
  "observation_refs": [],
  "session_commit": {
    "commit_status": "not_attempted",
    "expected_base_revision": 3
  },
  "started_at": "2026-08-03T19:38:30+08:00",
  "last_checkpoint_at": "2026-08-03T19:38:30+08:00",
  "metadata": {
    "x-fixture": true,
    "x-synthetic": true
  }
}
